{
  "$schema": "http://json-schema.org/draft-07/schema#",
  "$id": "https://aicore.dev/schemas/agent/suggest-response-1.0.schema.json",
  "title": "AIC Suggest Response v1.0",
  "type": "object",
  "additionalProperties": false,
  "required": [
    "schema_version",
    "command",
    "ok",
    "fast_path",
    "project_root",
    "partial",
    "candidate_count",
    "candidates",
    "diagnostics"
  ],
  "properties": {
    "schema_version": {
      "const": "1.0"
    },
    "command": {
      "const": "suggest"
    },
    "ok": {
      "type": "boolean"
    },
    "fast_path": {
      "type": "boolean"
    },
    "project_root": {
      "type": "string"
    },
    "partial": {
      "type": "string"
    },
    "candidate_count": {
      "type": "integer",
      "minimum": 0
    },
    "candidates": {
      "type": "array",
      "items": {
        "$ref": "#/$defs/suggest_candidate"
      }
    },
    "diagnostics": {
      "type": "array",
      "items": {
        "$ref": "#/$defs/diagnostic"
      }
    }
  },
  "$defs": {
    "symbol_kind": {
      "type": "string",
      "enum": [
        "function",
        "struct",
        "enum",
        "variant",
        "trait",
        "impl",
        "module"
      ]
    },
    "location": {
      "type": "object",
      "additionalProperties": false,
      "required": [
        "file",
        "line",
        "column",
        "span_start",
        "span_end"
      ],
      "properties": {
        "file": {
          "type": "string"
        },
        "line": {
          "type": "integer",
          "minimum": 1
        },
        "column": {
          "type": "integer",
          "minimum": 1
        },
        "span_start": {
          "type": "integer",
          "minimum": 0
        },
        "span_end": {
          "type": "integer",
          "minimum": 0
        }
      }
    },
    "suggest_candidate": {
      "type": "object",
      "additionalProperties": false,
      "required": [
        "qualified_name",
        "name",
        "kind",
        "signature",
        "match_kind",
        "distance",
        "score",
        "location"
      ],
      "properties": {
        "qualified_name": {
          "type": "string"
        },
        "name": {
          "type": "string"
        },
        "kind": {
          "$ref": "#/$defs/symbol_kind"
        },
        "module": {
          "type": "string"
        },
        "signature": {
          "type": "string"
        },
        "match_kind": {
          "type": "string",
          "enum": [
            "exact",
            "case_insensitive_exact",
            "prefix",
            "substring",
            "wildcard",
            "fuzzy"
          ]
        },
        "distance": {
          "type": "integer",
          "minimum": 0
        },
        "score": {
          "type": "integer"
        },
        "location": {
          "$ref": "#/$defs/location"
        },
        "effects": {
          "type": "array",
          "items": {
            "type": "string"
          }
        },
        "capabilities": {
          "type": "array",
          "items": {
            "type": "string"
          }
        },
        "generics": {
          "type": "array",
          "items": {
            "type": "string"
          }
        },
        "requires": {
          "type": "string"
        },
        "ensures": {
          "type": "string"
        },
        "container": {
          "type": "string"
        }
      }
    },
    "diagnostic_span": {
      "type": "object",
      "additionalProperties": false,
      "required": [
        "file",
        "start",
        "end",
        "label"
      ],
      "properties": {
        "file": {
          "type": "string"
        },
        "start": {
          "type": "integer",
          "minimum": 0
        },
        "end": {
          "type": "integer",
          "minimum": 0
        },
        "label": {
          "type": [
            "string",
            "null"
          ]
        },
        "start_line": {
          "type": "integer",
          "minimum": 1,
          "description": "1-based line of `start`; present when the source file is readable."
        },
        "start_column": {
          "type": "integer",
          "minimum": 1,
          "description": "1-based column of `start`, counted in Unicode scalar values."
        },
        "end_line": {
          "type": "integer",
          "minimum": 1,
          "description": "1-based line of `end`."
        },
        "end_column": {
          "type": "integer",
          "minimum": 1,
          "description": "1-based column of `end` (exclusive, like `end`)."
        }
      }
    },
    "suggested_fix": {
      "type": "object",
      "additionalProperties": false,
      "required": [
        "message",
        "replacement",
        "start",
        "end"
      ],
      "properties": {
        "message": {
          "type": "string"
        },
        "replacement": {
          "type": [
            "string",
            "null"
          ]
        },
        "start": {
          "type": [
            "integer",
            "null"
          ],
          "minimum": 0
        },
        "end": {
          "type": [
            "integer",
            "null"
          ],
          "minimum": 0
        }
      }
    },
    "diagnostic": {
      "type": "object",
      "additionalProperties": false,
      "required": [
        "code",
        "severity",
        "message",
        "spans",
        "help",
        "suggested_fixes"
      ],
      "properties": {
        "code": {
          "type": "string"
        },
        "severity": {
          "type": "string",
          "enum": [
            "error",
            "warning",
            "note"
          ]
        },
        "message": {
          "type": "string"
        },
        "spans": {
          "type": "array",
          "items": {
            "$ref": "#/$defs/diagnostic_span"
          }
        },
        "help": {
          "type": "array",
          "items": {
            "type": "string"
          }
        },
        "suggested_fixes": {
          "type": "array",
          "items": {
            "$ref": "#/$defs/suggested_fix"
          }
        },
        "reasoning": {
          "$ref": "#/$defs/diagnostic_reasoning"
        }
      }
    },
    "diagnostic_reasoning": {
      "type": "object",
      "additionalProperties": false,
      "required": [
        "schema_version",
        "strategy",
        "summary",
        "confidence",
        "evidence",
        "hypotheses",
        "next_actions",
        "spec_refs"
      ],
      "properties": {
        "schema_version": {
          "const": "1.0"
        },
        "strategy": {
          "type": "string"
        },
        "summary": {
          "type": "string"
        },
        "confidence": {
          "type": "integer",
          "minimum": 0,
          "maximum": 100
        },
        "evidence": {
          "type": "array",
          "items": {
            "type": "string"
          }
        },
        "hypotheses": {
          "type": "array",
          "items": {
            "$ref": "#/$defs/diagnostic_hypothesis"
          }
        },
        "next_actions": {
          "type": "array",
          "items": {
            "type": "string"
          }
        },
        "spec_refs": {
          "type": "array",
          "items": {
            "type": "string"
          }
        }
      }
    },
    "diagnostic_hypothesis": {
      "type": "object",
      "additionalProperties": false,
      "required": [
        "kind",
        "title",
        "detail",
        "confidence"
      ],
      "properties": {
        "kind": {
          "type": "string"
        },
        "title": {
          "type": "string"
        },
        "detail": {
          "type": "string"
        },
        "confidence": {
          "type": "integer",
          "minimum": 0,
          "maximum": 100
        }
      }
    }
  }
}
